{
  "$schema": "http://json-schema.org/draft-07/schema#",
  "title": "Authentication Test Fixture",
  "description": "Schema for JWT and API key authentication test fixtures covering token validation, expiration, signatures, and API key validation",
  "type": "object",
  "required": [
    "name",
    "description",
    "request",
    "expected_response"
  ],
  "properties": {
    "name": {
      "type": "string",
      "description": "Human-readable test case name",
      "minLength": 1
    },
    "description": {
      "type": "string",
      "description": "What this test validates",
      "minLength": 1
    },
    "category": {
      "type": "string",
      "enum": [
        "auth"
      ],
      "description": "Test category"
    },
    "source": {
      "type": "object",
      "description": "Source framework and test location",
      "required": [
        "framework"
      ],
      "properties": {
        "framework": {
          "type": "string",
          "description": "Source framework"
        },
        "inspired_by": {
          "type": "string",
          "description": "Framework that inspired this test"
        },
        "test_case": {
          "type": "string",
          "description": "Test case description"
        }
      }
    },
    "handler": {
      "type": "object",
      "description": "Handler configuration including middleware",
      "required": [
        "route",
        "method"
      ],
      "properties": {
        "route": {
          "type": "string",
          "description": "API route path"
        },
        "method": {
          "type": "string",
          "enum": [
            "GET",
            "POST",
            "PUT",
            "PATCH",
            "DELETE"
          ],
          "description": "HTTP method"
        },
        "parameters": {
          "type": "object",
          "description": "Handler parameters including headers",
          "properties": {
            "headers": {
              "type": "object",
              "description": "Expected headers"
            }
          }
        },
        "middleware": {
          "type": "object",
          "description": "Middleware configuration",
          "properties": {
            "jwt_auth": {
              "type": "object",
              "description": "JWT authentication middleware config",
              "properties": {
                "enabled": {
                  "type": "boolean"
                },
                "algorithm": {
                  "type": "string"
                },
                "secret": {
                  "type": "string"
                },
                "audience": {
                  "type": "array",
                  "items": {
                    "type": "string"
                  }
                },
                "issuer": {
                  "type": "string"
                },
                "leeway": {
                  "type": "integer"
                }
              }
            },
            "api_key_auth": {
              "type": "object",
              "description": "API key authentication middleware config",
              "properties": {
                "enabled": {
                  "type": "boolean"
                },
                "keys": {
                  "type": "array",
                  "items": {
                    "type": "string"
                  }
                },
                "header_name": {
                  "type": "string"
                }
              }
            }
          }
        }
      }
    },
    "request": {
      "type": "object",
      "description": "HTTP request details",
      "required": [
        "method",
        "path"
      ],
      "properties": {
        "method": {
          "type": "string",
          "enum": [
            "GET",
            "POST",
            "PUT",
            "PATCH",
            "DELETE",
            "HEAD",
            "OPTIONS"
          ],
          "description": "HTTP method"
        },
        "path": {
          "type": "string",
          "description": "Request path",
          "minLength": 1
        },
        "headers": {
          "type": "object",
          "description": "Request headers as key-value pairs",
          "additionalProperties": {
            "type": "string"
          }
        },
        "body": {
          "description": "Request body (any JSON type)"
        }
      }
    },
    "expected_response": {
      "type": "object",
      "description": "Expected HTTP response",
      "required": [
        "status_code"
      ],
      "properties": {
        "status_code": {
          "type": "integer",
          "description": "Expected HTTP status code",
          "minimum": 100,
          "maximum": 599
        },
        "body": {
          "description": "Expected response body (any JSON type)"
        },
        "headers": {
          "type": "object",
          "description": "Expected response headers",
          "additionalProperties": {
            "type": "string"
          }
        }
      }
    },
    "tags": {
      "type": "array",
      "description": "Tags for categorizing and filtering tests",
      "items": {
        "type": "string"
      }
    },
    "notes": {
      "type": "string",
      "description": "Additional notes or implementation details"
    },
    "skip": {
      "type": "boolean",
      "description": "Whether to skip this test"
    },
    "skip_reason": {
      "type": "string",
      "description": "Reason for skipping"
    }
  }
}
